{
  "agent_id": "a0402430-e269-4d95-93ee-621eb27bcafd",
  "capability_id": "CODE_RUN",
  "challenge_id": "519afe77-bfb9-4e0c-9d94-4ffedb64ea2b",
  "expires_at": "2026-02-01T11:49:27.006641+00:00",
  "instructions": "Execute: echo '776bf7928a92e71b676b87af3254a9e4' | sha256sum",
  "issued_at": "2026-02-01T11:49:17.006641+00:00",
  "nonce": "776bf7928a92e71b676b87af3254a9e4"
}